{"canonicalChecksum":"7de95a71aa7e5ee1891c6c738019fc2da9bca0d66b7fccf8f013253ba56fe75b","chainId":"cascade-chain","contractVersion":"waterfall-chain-preset-contract-v1","estimatedGraphWorkUnits":2000,"geometryChecksum":"aaaaaaaaaaaaaaaaaaaaaaaaaaaaaaaaaaaaaaaaaaaaaaaaaaaaaaaaaaaaaaaa","planVersion":1,"plungePools":[{"childId":"plunge-wf1","depthBlocks":2,"radiusBlocks":4,"waterfallNodeId":"wf1"},{"childId":"plunge-wf2","depthBlocks":2,"radiusBlocks":4,"waterfallNodeId":"wf2"}],"riverFeatureId":"role-river","riverPlanChecksum":"f461d8bca0a35e48b6de072eced663793ff2163f0cc9651681742890fd87469e","supportRadiusXZ":20,"totalDropMillionths":12000000,"waterfallCount":2,"waterfallNodeIds":["wf1","wf2"]}